{"meta":{"schema_version":"1.0.0","generated_at":"2026-03-19T14:57:57.335Z","pipeline_version":"0.2.0","source_type":"web","source_name":"Local App Home","confidence_summary":{"overall":0.8433333333333334,"observation":0.895,"semantics":0.875,"designSystem":0.76}},"source":{"input_type":"web","original_dimensions":{"width":1440,"height":2400,"unit":"px"},"url":"http://localhost:3000"},"observation":{"pages":[{"id":"page_1","index":0,"viewport":{"x":0,"y":0,"width":1440,"height":2400,"unit":"px"},"confidence":0.95}],"regions":[{"id":"region_1","bbox":{"x":32,"y":24,"width":1376,"height":2332,"unit":"px"},"type":"section","raw_text":"Design Extractor MVP Submit source details and generate a canonical design schema. Input type pdf image web Input path or URL Source name (optional) Build schema","style_guess":{"fontFamily":"Inter, system-ui, sans-serif","fontSize":16,"lineHeight":1.5,"fontWeight":400,"color":"#111827","backgroundColor":"#ffffff"},"alignment":{"horizontal":"left","vertical":"top","textAlign":"left","flow":"column"},"confidence":0.93}],"text_nodes":[{"id":"text_1","bbox":{"x":48,"y":40,"width":1344,"height":80,"unit":"px"},"type":"text","raw_text":"Design Extractor MVP Submit source details and generate a canonical design schema. Input type pdf image web Input path or URL Source name (optional) Build schema","style_guess":{"fontFamily":"Inter, system-ui, sans-serif","fontSize":34,"lineHeight":1.4,"fontWeight":600,"color":"#111827"},"alignment":{"horizontal":"left","vertical":"top","textAlign":"left","flow":"column"},"confidence":0.86}],"images":[{"id":"image_1","bbox":{"x":1128,"y":44,"width":240,"height":140,"unit":"px"},"type":"image","raw_text":"image placeholder","confidence":0.58}],"controls":[],"visual_groups":[]},"semantics":{"sections":[{"id":"section_1","role":"hero","node_ids":["region_1"],"confidence":0.875,"alternatives":[{"role":"masthead","confidence":0.37},{"role":"nav","confidence":0.35},{"role":"footer","confidence":0.33999999999999997}]}],"inferred_role_map":{"section_1":{"role":"hero","confidence":0.875,"alternatives":[{"role":"masthead","confidence":0.37},{"role":"nav","confidence":0.35},{"role":"footer","confidence":0.33999999999999997}]}},"reading_order":["region_1"],"relationships":[],"page_template_type":{"value":"marketing-landing-page","confidence":0.79,"alternatives":[{"value":"magazine-homepage","confidence":0.48},{"value":"documentation","confidence":0.44}]}},"designSystem":{"colorTokens":[{"name":"color-text-1","value":"#111827","confidence":0.78},{"name":"color-surface-2","value":"#ffffff","confidence":0.78}],"typeTokens":[{"name":"type-body-1","value":{"fontSize":16,"fontWeight":400},"confidence":0.74},{"name":"type-display-2","value":{"fontSize":34,"fontWeight":600},"confidence":0.74}],"spacingTokens":[],"radiusTokens":[{"name":"radius-sm","value":6,"confidence":0.64},{"name":"radius-md","value":12,"confidence":0.64}],"shadowTokens":[{"name":"shadow-sm","value":"0 1px 2px rgba(0,0,0,0.08)","confidence":0.6}],"layoutTokens":[{"name":"container-max-width","value":1120,"confidence":0.68},{"name":"grid-columns","value":{"desktop":12,"tablet":8,"mobile":4},"confidence":0.66}],"componentPatterns":[{"name":"hero","parts":["container","content"],"evidence_nodes":["region_1"],"confidence":0.875}],"variants":[],"interactionHints":[]},"responsive":{"breakpoints":[{"name":"sm","max_width":767},{"name":"md","min_width":768,"max_width":1023},{"name":"lg","min_width":1024}],"stacking_rules":[{"condition":"sm","behavior":"stack_regions_vertically","source":"observation.regions"},{"condition":"md","behavior":"two_column_when_possible","source":"semantic.article-grid"}],"container_rules":[{"container":"main","maxWidth":1120,"padding":{"sm":16,"md":24,"lg":32}}],"hide_show_behavior":[],"typography_scaling":[{"token":"type-display","sm":28,"md":36,"lg":44}],"spacing_scaling":[{"token":"space-2","sm":12,"md":16,"lg":20}]},"builderExports":{"lovable":{"format":"lovable.design-schema.v1","meta":{"sourceName":"Local App Home","generatedAt":"2026-03-19T14:57:57.335Z","confidence":0.8433333333333334},"layout":[{"id":"region_1","kind":"section","bbox":{"x":32,"y":24,"width":1376,"height":2332,"unit":"px"},"text":"Design Extractor MVP Submit source details and generate a canonical design schema. Input type pdf image web Input path or URL Source name (optional) Build schema","confidence":0.93}],"semanticSections":[{"id":"section_1","role":"hero","node_ids":["region_1"],"confidence":0.875,"alternatives":[{"role":"masthead","confidence":0.37},{"role":"nav","confidence":0.35},{"role":"footer","confidence":0.33999999999999997}]}],"tokens":{"colorTokens":[{"name":"color-text-1","value":"#111827","confidence":0.78},{"name":"color-surface-2","value":"#ffffff","confidence":0.78}],"typeTokens":[{"name":"type-body-1","value":{"fontSize":16,"fontWeight":400},"confidence":0.74},{"name":"type-display-2","value":{"fontSize":34,"fontWeight":600},"confidence":0.74}],"spacingTokens":[],"radiusTokens":[{"name":"radius-sm","value":6,"confidence":0.64},{"name":"radius-md","value":12,"confidence":0.64}],"shadowTokens":[{"name":"shadow-sm","value":"0 1px 2px rgba(0,0,0,0.08)","confidence":0.6}],"layoutTokens":[{"name":"container-max-width","value":1120,"confidence":0.68},{"name":"grid-columns","value":{"desktop":12,"tablet":8,"mobile":4},"confidence":0.66}],"componentPatterns":[{"name":"hero","parts":["container","content"],"evidence_nodes":["region_1"],"confidence":0.875}],"variants":[],"interactionHints":[]},"responsive":{"breakpoints":[{"name":"sm","max_width":767},{"name":"md","min_width":768,"max_width":1023},{"name":"lg","min_width":1024}],"stacking_rules":[{"condition":"sm","behavior":"stack_regions_vertically","source":"observation.regions"},{"condition":"md","behavior":"two_column_when_possible","source":"semantic.article-grid"}],"container_rules":[{"container":"main","maxWidth":1120,"padding":{"sm":16,"md":24,"lg":32}}],"hide_show_behavior":[],"typography_scaling":[{"token":"type-display","sm":28,"md":36,"lg":44}],"spacing_scaling":[{"token":"space-2","sm":12,"md":16,"lg":20}]}}}}